Speaker,Topic,Score,AtDebate,Speech,Score
Trump,None,-0.9938,FALSE,"(58:49)
But the fact that they’d even say that, and they didn’t do it for me, they just did a report. They said, not one terrorist 2019, check it out. They said, not one terrorist came into the country. Now we have thousands and thousands and thousands of terrorists pouring into our country at record levels, and it’s going to end very badly. It’s going to end very badly. We got to get them the hell out of here. We got to get them out of here fast. What they’ve done in allowing maybe 25 million people into our country, it should be illegal. They’re destroying, it should be illegal, and maybe it is illegal. They’re destroying our country. They’re ruining our country. In Aurora, Colorado, entire apartment complexes are being taken over by armed Venezuela gangs with weapons the likes of which even the military doesn’t see. They’re terrorizing residents and they’re just menacing the whole state.",-0.9938
Trump,Immigration,-0.9964,FALSE,"(59:43)
But they are menacing that community and the people are petrified, even the sheriff, he’s trying his best, but he’s got a small force by comparison, this is like a military force, and they’re vicious violent people. By the way, Venezuelan crime is down 72%. Crime is down all over the world because they’re sending their criminals, not just South America, from all over the world they’re sending their criminals. They’re sending people in jail for murder and drugs and everything else. They’re sending them into our country. They’re getting rid of them. Crime’s down all over the world. Our crime is through the roof, and you haven’t seen the migrant crime yet. It’s started and it’s vicious, but you haven’t seen the extent of it yet. They’re just getting settled in. Colorado is a total mess with a governor that has no idea what to do. He has no idea. He’s confused. He’s afraid of the migrants, but he doesn’t want to say it because that’s a bad thing to say. If you’re a Democrat, they put you right out of business.",-0.9964
Trump,None,-0.9516,FALSE,"He fears the policies of Kamala, but doesn’t want to lose his base or his job. He’s afraid to say anything about it. Colorado began the threat to democracy against me where they tried to unconstitutionally remove me from the ballot. I was the leading person in the whole country, leading everybody by a lot, and they said, let’s remove him from the ballot. And then they say, I’m a threat to democracy. Think about that. But Colorado was the one that did it at the behest of the governor, probably. Many people in Colorado were absolutely angry at it. They didn’t like it. Even Democrats and liberals, they said, that’s terrible. You can’t do that. Democrats did it. The concept of taking the number one person in the Republican Party by far, and taking them off the ballot so that the Republicans don’t even have a nominee, because this was very far down the line.",-0.9516
Trump,Criminal Justice,-0.9719,FALSE,"The case for me was won at the United States Supreme Court quickly and unanimously, and the governor, Jared Polis had no idea what to do or say, never apologized, never did anything. They’re radicals headed up by a radical governor in Colorado that has no clue how to solve this influx of crime into a state. And by the way, Colorado’s one state, it’s much worse in other states. But in Colorado they’ve taken over. I mean in Colorado, they’re so brazen. They’re taken over sections of the state, and getting them out will be a bloody story. Should have never been allowed to come into our country. Nobody checked them. Nobody checked were they criminals? Were they from jails? We have them pouring out from jails. We have the worst criminals in, all of these countries, 168 so far are registered, 168 countries. They’re in our country. And they said, if you come back, you’ll be executed.",-0.9719
Trump,Immigration,0.0747,FALSE,"You’ll be killed immediately. Not going to be easy, but we’ll do it. But they have no clue how to solve their influx of crime in Colorado or anywhere else. But far more importantly, heading this governor’s way are numbers of bad people that nobody will ever believe. That’s just a little small group of people that are taking over. These people are tough. I always say, they make our criminals look like nice people. At the time it happened, people said, I would win Colorado. Colorado’s traditionally not a Republican state, but I was actually tied and leading in polls in Colorado because people were so incensed at what this governor and his cronies had done by trying to strip the Republican Party of their candidate. So if I don’t win Colorado, it will be taken over by migrants and the governor will be sent fleeing, because the people of Colorado should really do something, that would be a classic.",0.0747
Trump,Opposing Candidate,-0.9881,FALSE,"They should do a major protest vote in favor of Trump to reject the threat to democracy that they caused by an attempt at ballot removal. And Illinois is really the same thing. And Maine, another one. I mean I don’t understand. I did very well in Maine, but they did that. The governors did that. Illinois is one of the worst-run states in the country, headed by a governor, J.B Pritzker, whose family threw him out of the family business, so he became governor instead, and his state is going to hell. It’s horrible what’s happening. So if you live in Chicago and your state is going to hell, vote for Donald Trump, just vote. We’ll do a good job. We’ll clean it up. We’ll get rid of that horrible crime. Do you know in Labor Day weekend, Chicago had 117 people shot, 17 died? This is worse than Afghanistan.",-0.9881
Trump,Immigration,-0.8298,FALSE,"This is worse than any place. It’s a war zone. Other states should also vote for Trump in protest because their way of life has been changed in America. Protest it. Go back to the Democrats in four years, but you won’t because we’ll clean up this mess and you’ll say, we’re never voting for a Democrat. We like Trump and his friends, migrants in crime are here in our country at levels never thought possible before, never even thought possible. You’re not safe even sitting here, to be honest with you. I’m the only one that’s going to get it done. Everybody’s saying that. I’m starting to believe it myself, but they’re saying the only one that’s going to get it done, and I will tell you, I’m going to get it done. And so go out and do that protest. If you’re Maine, if you’re in Illinois, if you’re in any state, because you’re being overrun by criminals, you’re being overrun by people.",-0.8298
Trump,None,0.4922,FALSE,"They’re not being checked. They’re not being vetted. They’re taking over our country. They’re forming armies in our country. And Aurora is just one example of many locations. Other places are probably even in worse shape, we just haven’t heard about them yet. And a lot of governors don’t like talking about it, like this guy Polis. He said, no, no, don’t talk about it. We don’t want the world to find out. The world has found out. The world has found out. They have all the pictures. They have all the tape that you want. I’ve never seen anything like it. They walk in, they throw people out of their apartments, they take over the whole building. Now they take over another building. They’re in the real estate business. Isn’t that nice? They were in jail two months ago. Now they’re in the real estate business in Colorado just two days ago, right here in small town Wisconsin.",0.4922
Trump,Criminal Justice,-0.9189,FALSE,"What a beautiful place. However, a member of a savage Venezuela gang was arrested for sexually assaulting a woman and attacking viciously a child. He’s charged with suffocation, child abuse, sexual assault, and many other things. Bad guy, shouldn’t be in the country, came out of jail, came out of jail in his country. I will get these monster criminals out of Wisconsin. I will get them out of our country. We’re going to get them out fast. We’re going to get them out fast, very fast. They’ll soon be back on the streets and jails of Caracas, Venezuela and other places from where they came. Think of it though. Venezuela crime is down 72%. People are saying, oh, isn’t it wonderful, Venezuela? In fact, if they win, we’re never going to lose touch with each other if they win, but we won’t come here. It’ll be too dangerous. We will have a meeting.",-0.9189
Trump,Criminal Justice,-0.7717,FALSE,"We will have a rally in Caracas, Venezuela, because it will be safe by comparison to Wisconsin. So we’ll all hop in a flight. We’ll go over to Caracas, Venezuela or one of hundreds of other countries that are safer than the US because our country is a very unsafe country now, and we’re really subject to what these people want to do. And these are violent people. These are people that were criminals at the worst level in their cities all over the world. 22 people out of the Congo in Africa. It’s not just South America. People think it’s Honduras and Guatemala, El Salvador, Mexico.",-0.7717
Trump,War in Middle East,-0.945,FALSE,"It’s not, it’s countries all over the world. They’re coming in. 22 people from the Congo in Africa. Where are you from? From the Congo. Oh, that’s nice. Where do you live? Jail. Oh, what did you do? It’s none of your business. That’s what they told the people. It’s none of your business. You can imagine what it is. But from Africa, from the Middle East, from Europe, from Asia, they’re coming in from everywhere. They’re getting rid of their criminals. They’re bringing them into the United States of America, our beautiful country, our now failing country. It’s a failing country under these lunatics. And they’re bringing them in at levels that nobody’s ever seen before. Ron Johnson sees it. He sees it all the time and he gets sick over it. But we’re going to do something about it, Ron. We’re going to get it done. We have no choice.",-0.945
Trump,Immigration,-0.8625,FALSE,"It’s not like we have a choice, not like we can say, oh, well, we’ll live with it. You can’t live with it because you’re going to be killed. These are killers, but from all over the world. You take a look at the crime statistics, you take a look at the jail statistics, the jails are being emptied out, the mental institutions are being emptied out, and insane asylums. And then the press, when I say Dr. Hannibal Lecter, the press says, oh, why did he mention that? They’re wise guys back, there just wise guys. They say he rambled and started talking about Hannibal Lecter. What does that have to do? That’s a representative of people that are coming into our country. Dr. Hannibal Lecter. He will have you for dinner. You know that? He will have you for dinner. No, but this is what’s happened. This is what’s happening at levels that nobody can even imagine.",-0.8625
Trump,None,0.9885,FALSE,"Millions and millions. JD Vance is doing a phenomenal job today. He said 25 million. He’s doing a great job. I picked the best athlete. I had great people, and great people. We have so many wonderful people. Marco was incredible and Tim Scott was incredible. And you have a governor in a certain place that has a lot of oil. You know who I’m talking about. How good was he? And you have just great places, and great people, and I got to know so many. I picked JD, JD, and I could have picked anyone. They would’ve been great. But JD had an incredible life. He had a mother who was very addicted to prescription drugs and not a lot of help from the father. And he went to, he was a great student, however, very smart. He went to Ohio State, graduated at the top of his class in two years.",0.9885
Trump,Criminal Justice,0.9343,FALSE,"I said, two years. That’s pretty good. I never heard of that. Then he went into the military, then he came out, got accepted to Yale Law School, which is very hard to do without a father, without a father that has connections. Very hard to do, almost impossible. The reason he was accepted was that he was really smart. He was smart as hell. And then he worked, I guess, essentially on Wall Street or Wall Street alternative, or equivalent, and did very well. And then he ran for office. I endorsed him and he became a senator from the great state of Ohio. And he’s doing amazingly well, but he’s a brilliant guy. And the press went after him for about the first week, and then they gave up, because he has the answers.",0.9343
Trump,Immigration,-0.9829,FALSE,"He’s conservative, but he really is like all of us. We’re all sort of conservative, but what we really are is we have common sense. We have common sense. Common sense is more important, Ron, than anything else. We need common sense. We’d like to have borders. We don’t want crime. We want good schools. We want nice housing. We want low interest rates. It’s called, we don’t want wars. Ideally we don’t want wars. Everyone thought I’d be a warmonger. I was the opposite. But I did scare people away from having wars. And you know what I did? I used tariffs. I heard two countries were going to have a war. I called them both. I said, here’s the story. You have a war. You’re going to have to pay a 200% tariff to do business in the United States. And they’d both say, the leaders would say to me, almost simultaneously, we’ve decided to make peace. I stopped so many wars. They went to Viktor Orbán, the fake news. They went to Viktor Orbán and they said, why is the world such a mess right now? It’s flaming up in the Middle East and Israel. And what’s happened with Russia, Ukraine. Why is it? They said, you need Trump back in. He said, nobody understood Trump. China was afraid of him. Russia was afraid of him. I stopped the Nord Stream pipeline, Nord Stream 2. And then they say, I was very friendly with Russia. I got along good with sort of everybody, but everybody paid up. They had to pay up. We changed so many trade deals that was so bad. USMCA, we made that one. That was a great one from the worst trade deal we ever had. NAFTA, the worst trade deal any country probably has ever had, but we did a really good job.",-0.9829
Trump,Economy,0.8844,FALSE,"But JD, we’re very proud of him. And he made a speech this morning and I heard it was great, and I think you will agree, Ron. He’s doing a fantastic job. As Vice President, Harris cast the tie-breaking votes that caused the worst inflation in American history costing a typical family $28,000. Think of that. Yesterday it was announced that we lost 438,000 full-time jobs in August. We lost 400, almost half a million jobs in August. We lost 24,000 manufacturing jobs, nearly 6,000 auto manufacturing jobs. And if I’m not elected, you will not have an auto industry at all. Volvo today announced they’re getting away from the electric. Other companies announced, we have paid trillions of dollars in subsidy for making these cars. And the market’s not there. That’s not there. It’s a shame, and I’m a big fan of electric cars. I think it’s great, but it’s got a market.",0.8844
Trump,Economy,-0.9713,FALSE,"But I also want gasoline-powered cars, and I want hybrids. I want everything. Hydrogen is maybe coming. We want everything. The real unemployment rate rose to 7.9% in August. Did you know that? 7.9%. Our country’s going down. Last month alone, American-born workers lost 1.3 million jobs, and migrants gained 635,000 jobs in a single month. Every job that we’ve gained has been replaced, not by American citizens, but by illegal migrants. Did you know that? Every job that was created over the last fairly short period of time was taken by illegal migrants. And I will tell you this, the black population and the Hispanic population are being decimated by these people coming in unchecked, unbalanced. They’re coming in and they’re taking the black population and the Hispanic population jobs. And next is going to be unions. You watch the unions suffer. The autoworkers are not going to exist in a year and a half or two years because of what that fool did who’s the head of the autoworkers. He’s a fool. Since the start",-0.9713
Trump,Economy,0.9299,FALSE,"… the start of this year, nearly 1 million Americans joined the unemployment roles. Nobody knows that. And, now, Kamala is pushing the largest individual small business tax in American history. And she said, “70 to 80% tax is probably a good idea, a bold idea that should be discussed.” 80%. Good luck with your small business. She and sleepy Joe Biden waged war on American energy, opened up the Russian pipeline, Nord Stream 2 after I had closed. It was done. It was closed. As soon as he came in, he approved it. But he shut down the Keystone XL Pipeline. Keystone, he shut it down, 48,000 jobs, and it was a very important pipeline actually, but we’ll get it open. But think of it. I shut down the biggest pipeline in the world, the Russian pipeline going to Germany and all over Europe. I shut it down. It was done. He gets in. He approved it. He approved it, but he shuts down the pipeline in this country, the XL Pipeline.",0.9299
Trump,War in Ukraine,0.7728,FALSE,"She reentered the horribly-unfair-to-the-United-States Paris Climate Accord. It sounds so nice. The Paris Climate Accord is such a nice name. Oh, isn’t that beautiful? We want the Wisconsin Accord. We want the people of Wisconsin, not the people of Paris. That Paris Accord was going to cost us $1 trillion. In other countries like China, it was considered third world. China. It’s a developing nation. They didn’t have to pay anything. India didn’t have to pay anything. Russia didn’t have to pay anything. France didn’t have to pay anything. Nobody had to pay. Only the stupid United States. We paid $1 trillion. And I closed it down and, as soon as he got back up, he opened it at even worse terms.",0.7728
Trump,Criminal Justice,-0.9943,FALSE,"Kamala Harris and the Communist left have unleashed a brutal plague of bloodshed, crime, chaos, misery and death upon our land. And it’s only going to get worse as Vice President Harris has presided over a 43% increase in violent crime, including a 58% increase in rape. She supports to fund the police and, during the 2020 riots, she encouraged her followers to donate to bail criminals, looters, arsonists and murderers. She was trying to get the murderers out of jail. Right? You’re shaking. Right? Everybody now knows it. And this is a person that wants to be President of the United States. And she didn’t get a vote. As California Attorney General, she redefined child sex trafficking, assault with a deadly weapon and rape of an unconscious person as totally nonviolent crimes. Oh, that’s nice.",-0.9943
Trump,None,0.6701,FALSE,"Kamala supports states being able to take minor children and perform sex change operation, take them away from their parents, perform sex-change operation and send them back home. Can you imagine you’re a parent and your son leaves the house and you say, “Jimmy, I love you so much. Go have a good day in school,” and your son comes back with a brutal operation? Can you even imagine this? What the hell is wrong with our country? Her running mate, Tampon Tim, did you see he signed a bill where tampons will be in every boy’s bathroom. Isn’t that nice? And he’s a whack job. You know they have a standard phrase that JD, who’s very solid, and I happen to be a very… I have other problems perhaps, but I’m a very solid person. But JD is solid. I’m solid.",0.6701
Trump,None,-0.7341,FALSE,"They said this was just a sound bite. They gave it to all the fake news. The fake news, they’re weird. No. He’s weird. He is really weird, this guy. Can you imagine? I’m weird? You know they do soundbites and they give them… They gave one the other day a manufactured… The vote was manufactured. It’s not a term that’s used politically. Every network headed up something about the vote was manufactured. They follow the lead of these people. But we’ve got the lead. You know what? We’ve got the people.",-0.7341
Trump,Criminal Justice,-0.4767,FALSE,"We got to stop the cheating. If we stop that cheating, if we don’t let them cheat, I don’t even have to campaign anymore. We’re going to win by so much. In the meantime, too big to rig. Too big to rig. But he even signed… Tampon Tim even signed a law that allows abortion in the ninth month and babies to be executed after birth. In other words, the baby is born. And what do you do if the mother decides she doesn’t want the baby? You execute. That’s not an abortion. That’s an execution. And nobody wants that. There are six radical left states that allow that, too, that nobody wants it to happen. Nobody wants to see it happen where they’re allowed to execute the baby after birth, and nobody talks about it.",-0.4767
Trump,None,0.4497,FALSE,"And we did a great thing when we got Roe v. Wade out of the federal government, got it back to the States, and, now, the states are all voting. And like Ronald Reagan, I happen to go with the exceptions. I think it’s important. But, other people, you have to go with your heart, but most… I’d say most people, 85% Republicans, they go with the exceptions for rape, incest, life of the mother, but… the three exceptions, but nobody wants to happen eighth month, seventh month, ninth month, but after birth, and you have after birth. And more people, more states are even planning on doing that.",0.4497
Trump,Economy,0.9209,FALSE,"Nobody wants that. And, now, what we’re doing is, because of what we’ve done, we’ve got, they wanted… All the great legal scholars wanted it out of the federal government. Democrats, Republicans, liberals, conservatives, everybody wanted it out because it didn’t belong there. They wanted it to go back to the States. And now the States are all voting. And, frankly, some of those votes are coming out very liberal if you look at Ohio, if you look at Kansas, if you look at some of the states. But the people are voting, and they’re voting. We put it in the hands of the people and they’re voting. And that’s the way people have wanted it for many, many years. And I’m just happy that we had Supreme Court justices that had the courage to do that because that has torn our country apart for 52 years and, now, the people are voting. From the moment we take back the White House from Comrade Kamala Harris, I believe we are going to have the four greatest years in the history of our country. We’re going to turn it around fast. Starting on day one, I will seal the border and stop the migrant invasion of our country. We will carry out the largest deportation operation of criminals in the history of America. We will defeat inflation, and we will make America affordable again. We will make America the dominant energy producer in the world by far. That’s called “Drill, baby, Drill.” Right? “Drill, baby, drill.”",0.9209
Trump,None,0.0772,FALSE,"And, remember, we have more liquid gold under our feet than any other country. In 12 months, I will cut your energy costs in half. That means, Wisconsin, we will cut it in half, and that includes your heating, air conditioning, electricity, gasoline for the cars. We’ll cut it in half, and we’ll do it easily. It won’t even be… I think we’ll do better than that 12 months. You can hold me to it. Hold me to it. I want you to hold me to it. We’re going to cut it in half.",0.0772
Trump,Economy,0.3291,FALSE,"I will turn the United States into a manufacturing superpower more than it has ever been. And other countries that make us pay a heavy tax to do business with them will be charged the same tax when they send their product into the United States. And we did it to a pretty strong extent when I was president, and we were going all the way that we had to solve the COVID problem, but we will be doing that. It will be called the Reciprocal Trade Act. It’s reciprocal. So, if China or any other country charges us a 100 or 200% tariff or tax, then we will likewise charge them a 100 or 200% tariff or tax in return. And my message is simple. Make your product here in America and only in America.",0.3291
Trump,Economy,0.4417,FALSE,"So we’re going to charge tariffs to all these foreign countries that are coming in and ripping us off and taking our jobs and destroying our manufacturing. And it’s what they do. We’re going to do it the same as they do. And some of these people that are making decisions in Washington, they’re very suspect, I can tell you. Not this group. This group. That’s why they’re here. They hate what they see happening. We’re not going to be taken advantage of anymore. Just as we made great inroads in progress four years ago, nobody ever made such progress as we. We had the greatest four years. We rebuilt the military. We had the largest tax cut in history, the largest regulation cut in history.",0.4417
